{
  "catalog_id": "payroll-knowledge-graph-synthetic-v1",
  "version": "1.0.0",
  "scope": "Graphe synthetique reliant regles, variables, compteurs Kelio, rubriques Nibelis et parametres de paie sans calcul reel",
  "fixture_type": "synthetic_example",
  "security_notice": "Exemple synthetique uniquement. Les relations n'activent aucun calcul et ne prouvent aucun droit INEOS.",
  "relations": [
    { "relation_id": "KG_RULE_VAR_001", "source_type": "rule", "source_id": "WT_5X8_JOURS_DUS_001", "target_type": "variable", "target_id": "annee_de_reference", "relation_type": "uses_variable", "description": "La regle 5x8 jours dus utilise l'annee de reference comme variable de contexte.", "confidence": "medium", "validation_status": "synthetic_example", "synthetic_only": true, "calculation_allowed": false, "documentation": ["Lien issu des variables declarees dans le catalogue PayrollRule."] },
    { "relation_id": "KG_RULE_VAR_002", "source_type": "rule", "source_id": "WT_5X8_RCTP_001", "target_type": "variable", "target_id": "compteur_RCTP", "relation_type": "uses_variable", "description": "La regle RCTP utilise le compteur RCTP comme variable.", "confidence": "medium", "validation_status": "synthetic_example", "synthetic_only": true, "calculation_allowed": false, "documentation": ["Lien de couverture synthetique."] },
    { "relation_id": "KG_RULE_VAR_003", "source_type": "rule", "source_id": "WT_5X8_RCTR_001", "target_type": "variable", "target_id": "compteur_RCTR", "relation_type": "uses_variable", "description": "La regle RCTR utilise le compteur RCTR comme variable.", "confidence": "medium", "validation_status": "synthetic_example", "synthetic_only": true, "calculation_allowed": false, "documentation": ["Lien de couverture synthetique."] },
    { "relation_id": "KG_RULE_VAR_004", "source_type": "rule", "source_id": "WT_5X8_RJFJ_TO_JR_001", "target_type": "variable", "target_id": "compteur_RJFJ_avant", "relation_type": "uses_variable", "description": "La conversion RJFJ vers JR depend du compteur RJFJ avant regularisation.", "confidence": "medium", "validation_status": "synthetic_example", "synthetic_only": true, "calculation_allowed": false, "documentation": ["Lien de couverture synthetique."] },
    { "relation_id": "KG_RULE_VAR_005", "source_type": "rule", "source_id": "WT_5X8_JR_REGULARISATION_001", "target_type": "variable", "target_id": "solde_JR", "relation_type": "uses_variable", "description": "La regularisation JR utilise le solde JR comme variable de controle.", "confidence": "medium", "validation_status": "synthetic_example", "synthetic_only": true, "calculation_allowed": false, "documentation": ["Lien de couverture synthetique."] },
    { "relation_id": "KG_RULE_VAR_006", "source_type": "rule", "source_id": "WT_5X8_RJFJ_RJFN_USAGE_001", "target_type": "variable", "target_id": "solde_RJFJ", "relation_type": "uses_variable", "description": "L'usage RJFJ/RJFN depend du solde RJFJ.", "confidence": "medium", "validation_status": "synthetic_example", "synthetic_only": true, "calculation_allowed": false, "documentation": ["Lien de couverture synthetique."] },
    { "relation_id": "KG_RULE_VAR_007", "source_type": "rule", "source_id": "LEAVE_CP_ACQUISITION_001", "target_type": "variable", "target_id": "mois_travailles", "relation_type": "uses_variable", "description": "L'acquisition CP utilise les mois travailles.", "confidence": "medium", "validation_status": "synthetic_example", "synthetic_only": true, "calculation_allowed": false, "documentation": ["Lien de couverture synthetique."] },
    { "relation_id": "KG_RULE_VAR_008", "source_type": "rule", "source_id": "LEAVE_CP_REQUEST_DELAY_001", "target_type": "variable", "target_id": "date_demande", "relation_type": "uses_variable", "description": "Le delai de demande CP utilise la date de demande.", "confidence": "medium", "validation_status": "synthetic_example", "synthetic_only": true, "calculation_allowed": false, "documentation": ["Lien de couverture synthetique."] },
    { "relation_id": "KG_RULE_VAR_009", "source_type": "rule", "source_id": "LEAVE_CP_RECALL_CCNIC_001", "target_type": "variable", "target_id": "date_rappel", "relation_type": "uses_variable", "description": "Le rappel CP utilise la date de rappel comme variable.", "confidence": "medium", "validation_status": "synthetic_example", "synthetic_only": true, "calculation_allowed": false, "documentation": ["Lien de couverture synthetique."] },
    { "relation_id": "KG_RULE_VAR_010", "source_type": "rule", "source_id": "LEAVE_CP_INDEMNITY_COMPARE_001", "target_type": "variable", "target_id": "salaire_reference", "relation_type": "uses_variable", "description": "La comparaison d'indemnite CP utilise le salaire de reference.", "confidence": "medium", "validation_status": "synthetic_example", "synthetic_only": true, "calculation_allowed": false, "documentation": ["Lien de couverture synthetique."] },
    { "relation_id": "KG_RULE_VAR_011", "source_type": "rule", "source_id": "PAY_HOLIDAY_DAY_WORKED_001", "target_type": "variable", "target_id": "date_jour_ferie", "relation_type": "uses_variable", "description": "La regle jour ferie travaille utilise la date du jour ferie.", "confidence": "medium", "validation_status": "synthetic_example", "synthetic_only": true, "calculation_allowed": false, "documentation": ["Lien de couverture synthetique."] },
    { "relation_id": "KG_RULE_VAR_012", "source_type": "rule", "source_id": "PAY_HOLIDAY_POSTED_NORMAL_001", "target_type": "variable", "target_id": "poste_planifie", "relation_type": "uses_variable", "description": "La regle jour ferie poste normal utilise le poste planifie.", "confidence": "medium", "validation_status": "synthetic_example", "synthetic_only": true, "calculation_allowed": false, "documentation": ["Lien de couverture synthetique."] },
    { "relation_id": "KG_RULE_VAR_013", "source_type": "rule", "source_id": "PAY_HOLIDAY_POSTED_REST_001", "target_type": "variable", "target_id": "repos_initial", "relation_type": "uses_variable", "description": "La regle jour ferie sur repos utilise le repos initial.", "confidence": "medium", "validation_status": "synthetic_example", "synthetic_only": true, "calculation_allowed": false, "documentation": ["Lien de couverture synthetique."] },
    { "relation_id": "KG_RULE_VAR_014", "source_type": "rule", "source_id": "PAY_HSUP_TRANCHES_001", "target_type": "variable", "target_id": "heures_validees", "relation_type": "uses_variable", "description": "La regle heures supplementaires utilise les heures validees.", "confidence": "medium", "validation_status": "synthetic_example", "synthetic_only": true, "calculation_allowed": false, "documentation": ["Lien de couverture synthetique."] },
    { "relation_id": "KG_RULE_VAR_015", "source_type": "rule", "source_id": "WT_REPOS_QUOTIDIEN_001", "target_type": "variable", "target_id": "heure_fin_poste", "relation_type": "uses_variable", "description": "Le repos quotidien utilise l'heure de fin de poste.", "confidence": "medium", "validation_status": "synthetic_example", "synthetic_only": true, "calculation_allowed": false, "documentation": ["Lien de couverture synthetique."] },
    { "relation_id": "KG_RULE_VAR_016", "source_type": "rule", "source_id": "WT_CHANGEMENT_ROULEMENT_PREVENANCE_001", "target_type": "variable", "target_id": "date_information", "relation_type": "uses_variable", "description": "Le changement de roulement utilise la date d'information.", "confidence": "medium", "validation_status": "synthetic_example", "synthetic_only": true, "calculation_allowed": false, "documentation": ["Lien de couverture synthetique."] },
    { "relation_id": "KG_RULE_VAR_017", "source_type": "rule", "source_id": "PAY_MAINTIEN_POSTE_NON_PREVU_001", "target_type": "variable", "target_id": "heure_fin_prevue", "relation_type": "uses_variable", "description": "Le maintien poste non prevu utilise l'heure de fin prevue.", "confidence": "medium", "validation_status": "synthetic_example", "synthetic_only": true, "calculation_allowed": false, "documentation": ["Lien de couverture synthetique."] },
    { "relation_id": "KG_RULE_VAR_018", "source_type": "rule", "source_id": "PAY_RAPPEL_HORS_ASTREINTE_001", "target_type": "variable", "target_id": "heure_appel", "relation_type": "uses_variable", "description": "Le rappel hors astreinte utilise l'heure d'appel.", "confidence": "medium", "validation_status": "synthetic_example", "synthetic_only": true, "calculation_allowed": false, "documentation": ["Lien de couverture synthetique."] },
    { "relation_id": "KG_RULE_VAR_019", "source_type": "rule", "source_id": "PAY_RAPPEL_ASTREINTE_001", "target_type": "variable", "target_id": "planning_astreinte", "relation_type": "uses_variable", "description": "Le rappel astreinte utilise le planning d'astreinte.", "confidence": "medium", "validation_status": "synthetic_example", "synthetic_only": true, "calculation_allowed": false, "documentation": ["Lien de couverture synthetique."] },
    { "relation_id": "KG_RULE_VAR_020", "source_type": "rule", "source_id": "PAY_13E_MOIS_001", "target_type": "variable", "target_id": "salaire_reference", "relation_type": "uses_variable", "description": "Le 13e mois utilise le salaire de reference.", "confidence": "medium", "validation_status": "synthetic_example", "synthetic_only": true, "calculation_allowed": false, "documentation": ["Lien de couverture synthetique."] },
    { "relation_id": "KG_RULE_VAR_021", "source_type": "rule", "source_id": "PAY_MALADIE_MAINTIEN_001", "target_type": "variable", "target_id": "anciennete", "relation_type": "uses_variable", "description": "Le maintien maladie utilise l'anciennete.", "confidence": "medium", "validation_status": "synthetic_example", "synthetic_only": true, "calculation_allowed": false, "documentation": ["Lien de couverture synthetique."] },